{
  "schema_version": "1.0",
  "id": "codex",
  "adapter_version": "0.1.0-dev.2",
  "methodology_version": "3.1.0",
  "status": "experimental",
  "tested_host_versions": [
    "0.150.1"
  ],
  "surfaces": [
    "local-cli",
    "desktop",
    "ide-standalone-skill"
  ],
  "capabilities_file": "./capabilities.json",
  "guard_mode_default": false,
  "install": [
    "standalone (all surfaces, including the IDE extension): cp -r skills/braids <project>/.agents/skills/braids",
    "installable plugin from a clone (CLI and desktop only): codex plugin marketplace add <repo>",
    "codex plugin list --available --json",
    "codex plugin add braids@braids --json, then start a new session"
  ],
  "disable": [
    "standalone: remove or rename .agents/skills/braids and start a new session",
    "installable plugin: codex plugin remove braids --json"
  ],
  "uninstall": [
    "codex plugin remove braids@braids --json (the bare name is rejected; the marketplace must be named)",
    "codex plugin marketplace remove braids --json",
    "rm -rf <project>/.agents/skills/braids",
    "rmdir ~/.codex/plugins/cache/braids, which is left behind empty"
  ],
  "conformance": [
    "discovery: pass \u2014 on 0.150.1 codex plugin marketplace add resolves the generated .claude-plugin/marketplace.json, codex plugin add installs the full skill tree into ~/.codex/plugins/cache, and codex plugin list reports it installed and enabled",
    "activation: not-exercised \u2014 model-invoked skill selection needs graded runs, not a packaging check",
    "semantic-parity: not-exercised \u2014 requires graded cross-host runs via scripts/run_evals.py --results",
    "progressive-disclosure: pass \u2014 the package ships seven independently routed skills, keeps core references one level deep, and adds nothing to AGENTS.md",
    "authority: pass \u2014 adapter ships no hooks, agents or tool policy, so it cannot change the inherited sandbox or approval mode",
    "degradation: pass \u2014 no MCP, hook or hosted-tool dependency is declared, so absent optional tools remove no adapter behaviour",
    "enforcement-truthfulness: not-applicable \u2014 this adapter claims no deterministic blocking",
    "state-survival: not-exercised \u2014 compaction and resume behaviour was not measured",
    "isolation: not-applicable \u2014 no subagents are shipped; subagent threads are context isolation, not filesystem isolation",
    "uninstall: pass \u2014 plugin remove plus marketplace remove cleared every cached file and every codex plugin list entry, leaving only an empty ~/.codex/plugins/cache/braids directory"
  ],
  "source_revalidated_at": "2026-08-31",
  "limitations": [
    "The installable .codex-plugin wrapper is not supported by the Codex IDE extension; that surface must use the standalone .agents/skills path.",
    "No codex plugin validate command exists, so packaging is gated by the marketplace list/add/remove JSON flow instead.",
    "Codex reads marketplace manifests only from agents/plugins/api_marketplace.json, .claude-plugin/marketplace.json or .cursor-plugin/marketplace.json; there is no .codex-plugin marketplace location, so the adapter ships the .claude-plugin form.",
    "codex plugin remove rejects a bare plugin name and requires plugin@marketplace.",
    "Removing the plugin and the marketplace leaves an empty ~/.codex/plugins/cache/braids directory; nothing loads from it, but it is not deleted automatically.",
    "Hooks require separate trust; hosted WebSearch is outside local hook coverage, write_stdin raises no second PreToolUse, background hooks cannot block, and parsed prompt/agent handlers are currently skipped.",
    "Subagents get separate threads and contexts but inherit the parent sandbox and approval mode; that is not filesystem or worktree isolation.",
    "The Codex-only skill interface descriptor (agents/openai.yaml) is owned by this adapter, not by the portable kernel, so no other host package ships it.",
    "Guard hooks and custom agents are deliberately absent until their coverage is measured."
  ],
  "package": {
    "skill_target": "skills",
    "manifests": [
      {
        "path": ".codex-plugin/plugin.json",
        "content": {
          "name": "@name",
          "version": "@version",
          "description": "@description",
          "skills": "./skills/",
          "keywords": "@keywords",
          "author": "@author",
          "license": "@license",
          "homepage": "@homepage",
          "repository": "@repository",
          "interface": {
            "displayName": "Braids",
            "shortDescription": "Risk-calibrated engineering guidance",
            "longDescription": "Braids matches engineering depth to real risk, challenges failure modes, and keeps material claims tied to evidence.",
            "developerName": "Vyas Devgna",
            "category": "Developer Tools",
            "capabilities": [
              "Engineering guidance",
              "Code review",
              "Risk analysis"
            ],
            "websiteURL": "https://braids.vyasdevgna.online",
            "brandColor": "#2F6F63",
            "defaultPrompt": [
              "Use Braids to right-size and implement this change.",
              "Audit this repository's highest engineering risks.",
              "Review this change and identify unsupported claims."
            ]
          }
        }
      },
      {
        "path": ".claude-plugin/marketplace.json",
        "content": {
          "name": "braids",
          "description": "Braids \u2014 adaptive engineering governance for AI coding agents.",
          "plugins": [
            {
              "name": "@name",
              "description": "@description",
              "source": "./"
            }
          ],
          "owner": "@author"
        }
      }
    ],
    "extra_files": {
      "skills/braids/agents/openai.yaml": "files/openai.yaml"
    }
  }
}
